TRACK,TITLE,ARTIST,STARTTIME,ENDTIME,DURATION
1,残酷な天使のテーゼ (A Cruel Angel's Thesis),高橋洋子 (Yoko Takahashi),00:17:14,00:21:27,253
2,Any Way You Want It,Journey,00:22:59,00:26:19,200
3,Lady Marmalade,"Christina Aguilera, Lil' Kim, Mya, P!nk",00:27:53,00:31:49,236
4,Don't Stop Me Now,Queen,00:32:41,00:36:22,221
5,Dancing In The Street,David Bowie & Mick Jagger / Original： Martha & The Vandellas,00:37:25,00:40:37,192
6,Holding Out For A Hero,Bonnie Tyler,00:41:40,00:45:36,236
7,Heart Boner,NSP,00:46:45,00:50:53,248
8,TiK ToK,Ke$ha,00:51:58,00:55:24,206
9,California Gurls,Katy Perry & Snoop Dogg,00:56:07,01:00:01,234
